{
  "schema_version": "1.0.0",
  "generator": "nncar_sim",
  "profile": "mg513x_12v_4s_default",
  "profile_version": "1.0.0",
  "profile_verified": false,
  "seed": 0,
  "git_commit": "unknown",
  "tick_dt_s": 0.002000,
  "line_dt_s": 0.010000,
  "scenario": {
    "duration_s": 10.000,
    "v_desired_mps": 0.900,
    "offset_m": 0.020,
    "heading_deg": 3.000,
    "amp_m": 0.000,
    "wavelength_m": 1.000,
    "rail_v": 12.00
  }
}
